{
  "schema_version": 1,
  "handover_id": "HO-20260401T093119Z",
  "generated_at_utc": "2026-04-01T09:31:19Z",
  "agent": {
    "name": "codex",
    "session_label": "HO-20260401T093119Z"
  },
  "scope": "Mapper-Toolkit multi-screen TUI refinement and runtime-safe command execution refresh",
  "highlights": [
    "Converted TUI into true per-section screen instances with screen routing",
    "Fixed runtime refresh path in command execution to update active screen status/output safely",
    "Revalidated tests, contract check, and all governance guards"
  ],
  "changed_files": [
    {
      "status_code": "?",
      "status": "untracked",
      "path": "apps/mapper-app/app/src/main/java/dev/fishit/mapper/wave01/debug/RuntimeToolkitCommandReceiver.kt",
      "old_path": null
    },
    {
      "status_code": "?",
      "status": "untracked",
      "path": "apps/mapper-app/app/src/main/java/dev/fishit/mapper/wave01/debug/RuntimeToolkitOkHttp.kt",
      "old_path": null
    },
    {
      "status_code": "?",
      "status": "untracked",
      "path": "apps/mapper-app/app/src/main/java/dev/fishit/mapper/wave01/debug/RuntimeToolkitTelemetry.kt",
      "old_path": null
    },
    {
      "status_code": "?",
      "status": "untracked",
      "path": "contracts/correlation.schema.json",
      "old_path": null
    },
    {
      "status_code": "?",
      "status": "untracked",
      "path": "contracts/mapper_toolkit_tui_catalog.json",
      "old_path": null
    },
    {
      "status_code": "?",
      "status": "untracked",
      "path": "contracts/runtime_event.schema.json",
      "old_path": null
    },
    {
      "status_code": "?",
      "status": "untracked",
      "path": "contracts/runtime_toolkit_v2.json",
      "old_path": null
    },
    {
      "status_code": "?",
      "status": "untracked",
      "path": "docs/archive/correlation.schema.json",
      "old_path": null
    },
    {
      "status_code": "?",
      "status": "untracked",
      "path": "docs/archive/mapper_toolkit_tui_catalog.contract.json",
      "old_path": null
    },
    {
      "status_code": "?",
      "status": "untracked",
      "path": "docs/archive/runtime_event.schema.json",
      "old_path": null
    },
    {
      "status_code": "?",
      "status": "untracked",
      "path": "docs/archive/runtime_toolkit_v2.contract.json",
      "old_path": null
    },
    {
      "status_code": "?",
      "status": "untracked",
      "path": "handovers/HO-20260401T084821Z.json",
      "old_path": null
    },
    {
      "status_code": "?",
      "status": "untracked",
      "path": "handovers/HO-20260401T092145Z.json",
      "old_path": null
    },
    {
      "status_code": "?",
      "status": "untracked",
      "path": "handovers/HO-20260401T093037Z.json",
      "old_path": null
    },
    {
      "status_code": "?",
      "status": "untracked",
      "path": "scripts/device/mapper-toolkit.sh",
      "old_path": null
    },
    {
      "status_code": "?",
      "status": "untracked",
      "path": "scripts/device/toolkit/__pycache__/main.cpython-311.pyc",
      "old_path": null
    },
    {
      "status_code": "?",
      "status": "untracked",
      "path": "scripts/device/toolkit/__pycache__/tui_catalog.cpython-311.pyc",
      "old_path": null
    },
    {
      "status_code": "?",
      "status": "untracked",
      "path": "scripts/device/toolkit/bootstrap.sh",
      "old_path": null
    },
    {
      "status_code": "?",
      "status": "untracked",
      "path": "scripts/device/toolkit/main.py",
      "old_path": null
    },
    {
      "status_code": "?",
      "status": "untracked",
      "path": "scripts/device/toolkit/mapper_toolkit_tui.sh",
      "old_path": null
    },
    {
      "status_code": "?",
      "status": "untracked",
      "path": "scripts/device/toolkit/mitm_bridge.sh",
      "old_path": null
    },
    {
      "status_code": "?",
      "status": "untracked",
      "path": "scripts/device/toolkit/runtime_dataset_cli.py",
      "old_path": null
    },
    {
      "status_code": "?",
      "status": "untracked",
      "path": "scripts/device/toolkit/tests/__pycache__/test_tui_catalog.cpython-311.pyc",
      "old_path": null
    },
    {
      "status_code": "?",
      "status": "untracked",
      "path": "scripts/device/toolkit/tests/test_tui_catalog.py",
      "old_path": null
    },
    {
      "status_code": "?",
      "status": "untracked",
      "path": "scripts/device/toolkit/tui_catalog.py",
      "old_path": null
    },
    {
      "status_code": "M",
      "status": "modified",
      "path": "apps/mapper-app/app/src/main/AndroidManifest.xml",
      "old_path": null
    },
    {
      "status_code": "M",
      "status": "modified",
      "path": "apps/mapper-app/app/src/main/java/info/plateaukao/einkbro/browser/NinjaWebViewClient.kt",
      "old_path": null
    },
    {
      "status_code": "M",
      "status": "modified",
      "path": "apps/mapper-app/app/src/main/java/info/plateaukao/einkbro/search/suggestion/DuckDuckGoSuggestionsRepository.kt",
      "old_path": null
    },
    {
      "status_code": "M",
      "status": "modified",
      "path": "apps/mapper-app/app/src/main/java/info/plateaukao/einkbro/search/suggestion/GoogleSuggestionsRepository.kt",
      "old_path": null
    },
    {
      "status_code": "M",
      "status": "modified",
      "path": "apps/mapper-app/app/src/main/java/info/plateaukao/einkbro/service/InstapaperRepository.kt",
      "old_path": null
    },
    {
      "status_code": "M",
      "status": "modified",
      "path": "apps/mapper-app/app/src/main/java/info/plateaukao/einkbro/service/OpenAiRepository.kt",
      "old_path": null
    },
    {
      "status_code": "M",
      "status": "modified",
      "path": "apps/mapper-app/app/src/main/java/info/plateaukao/einkbro/service/TranslateRepository.kt",
      "old_path": null
    },
    {
      "status_code": "M",
      "status": "modified",
      "path": "apps/mapper-app/app/src/main/java/info/plateaukao/einkbro/tts/ETts.kt",
      "old_path": null
    },
    {
      "status_code": "M",
      "status": "modified",
      "path": "apps/mapper-app/app/src/main/java/info/plateaukao/einkbro/unit/HelperUnit.kt",
      "old_path": null
    },
    {
      "status_code": "M",
      "status": "modified",
      "path": "contracts/decision_trace.json",
      "old_path": null
    },
    {
      "status_code": "M",
      "status": "modified",
      "path": "contracts/dependency_intake.json",
      "old_path": null
    },
    {
      "status_code": "M",
      "status": "modified",
      "path": "contracts/doc_contract.json",
      "old_path": null
    },
    {
      "status_code": "M",
      "status": "modified",
      "path": "contracts/generation_plan.json",
      "old_path": null
    },
    {
      "status_code": "M",
      "status": "modified",
      "path": "docs/DEPENDENCY_INTAKE.md",
      "old_path": null
    }
  ]
}
