{
  "schema_version": 1,
  "handover_id": "HO-20260402T122221Z",
  "generated_at_utc": "2026-04-02T12:22:21Z",
  "agent": {
    "name": "codex",
    "session_label": "HO-20260402T122221Z"
  },
  "scope": "mission-wizard-fixture-replay-export-history",
  "highlights": [
    "Integrated Fixture Replay + Export History dialogs into BrowserActivity with replay mission handoff and validated all gates/tests"
  ],
  "changed_files": [
    {
      "status_code": "?",
      "status": "untracked",
      "path": "apps/mapper-app/app/src/main/assets/mapper_mission_registry.json",
      "old_path": null
    },
    {
      "status_code": "?",
      "status": "untracked",
      "path": "apps/mapper-app/app/src/main/java/dev/fishit/mapper/wave01/debug/RuntimeToolkitMissionWizard.kt",
      "old_path": null
    },
    {
      "status_code": "?",
      "status": "untracked",
      "path": "apps/mapper-app/app/src/main/java/info/plateaukao/einkbro/view/dialog/mission/MissionExportHistoryDialogFragment.kt",
      "old_path": null
    },
    {
      "status_code": "?",
      "status": "untracked",
      "path": "apps/mapper-app/app/src/main/java/info/plateaukao/einkbro/view/dialog/mission/MissionExportSummaryDialogFragment.kt",
      "old_path": null
    },
    {
      "status_code": "?",
      "status": "untracked",
      "path": "apps/mapper-app/app/src/main/java/info/plateaukao/einkbro/view/dialog/mission/MissionFixtureReplayDialogFragment.kt",
      "old_path": null
    },
    {
      "status_code": "?",
      "status": "untracked",
      "path": "apps/mapper-app/app/src/main/java/info/plateaukao/einkbro/view/dialog/mission/MissionLauncherDialogFragment.kt",
      "old_path": null
    },
    {
      "status_code": "?",
      "status": "untracked",
      "path": "apps/mapper-app/app/src/main/java/info/plateaukao/einkbro/view/dialog/mission/MissionWizardSetupDialogFragment.kt",
      "old_path": null
    },
    {
      "status_code": "?",
      "status": "untracked",
      "path": "apps/mapper-app/app/src/test/java/dev/fishit/mapper/wave01/debug/RuntimeToolkitMissionWizardTest.kt",
      "old_path": null
    },
    {
      "status_code": "?",
      "status": "untracked",
      "path": "contracts/mapper_target.yaml",
      "old_path": null
    },
    {
      "status_code": "?",
      "status": "untracked",
      "path": "contracts/provider_draft_export.schema.json",
      "old_path": null
    },
    {
      "status_code": "?",
      "status": "untracked",
      "path": "docs/archive/provider_draft_export.schema.json",
      "old_path": null
    },
    {
      "status_code": "?",
      "status": "untracked",
      "path": "docs/mapper_target.yaml",
      "old_path": null
    },
    {
      "status_code": "?",
      "status": "untracked",
      "path": "handovers/HO-20260402T072854Z.json",
      "old_path": null
    },
    {
      "status_code": "?",
      "status": "untracked",
      "path": "handovers/HO-20260402T075604Z.json",
      "old_path": null
    },
    {
      "status_code": "?",
      "status": "untracked",
      "path": "handovers/HO-20260402T082152Z.json",
      "old_path": null
    },
    {
      "status_code": "?",
      "status": "untracked",
      "path": "handovers/HO-20260402T082426Z.json",
      "old_path": null
    },
    {
      "status_code": "?",
      "status": "untracked",
      "path": "handovers/HO-20260402T092652Z.json",
      "old_path": null
    },
    {
      "status_code": "?",
      "status": "untracked",
      "path": "handovers/HO-20260402T092738Z.json",
      "old_path": null
    },
    {
      "status_code": "?",
      "status": "untracked",
      "path": "handovers/HO-20260402T104921Z.json",
      "old_path": null
    },
    {
      "status_code": "?",
      "status": "untracked",
      "path": "handovers/HO-20260402T115004Z.json",
      "old_path": null
    },
    {
      "status_code": "?",
      "status": "untracked",
      "path": "handovers/HO-20260402T120113Z.json",
      "old_path": null
    },
    {
      "status_code": "?",
      "status": "untracked",
      "path": "handovers/HO-20260402T120426Z.json",
      "old_path": null
    },
    {
      "status_code": "?",
      "status": "untracked",
      "path": "scripts/device/toolkit/__pycache__/main.cpython-311.pyc",
      "old_path": null
    },
    {
      "status_code": "?",
      "status": "untracked",
      "path": "scripts/device/toolkit/__pycache__/runtime_dataset_cli.cpython-311.pyc",
      "old_path": null
    },
    {
      "status_code": "?",
      "status": "untracked",
      "path": "scripts/device/toolkit/__pycache__/tui_catalog.cpython-311.pyc",
      "old_path": null
    },
    {
      "status_code": "?",
      "status": "untracked",
      "path": "scripts/device/toolkit/tests/__pycache__/test_runtime_dataset_hardening.cpython-311.pyc",
      "old_path": null
    },
    {
      "status_code": "?",
      "status": "untracked",
      "path": "scripts/device/toolkit/tests/__pycache__/test_runtime_dataset_integration_smoke.cpython-311.pyc",
      "old_path": null
    },
    {
      "status_code": "?",
      "status": "untracked",
      "path": "scripts/device/toolkit/tests/__pycache__/test_runtime_dataset_regression_fixture.cpython-311.pyc",
      "old_path": null
    },
    {
      "status_code": "?",
      "status": "untracked",
      "path": "scripts/device/toolkit/tests/__pycache__/test_tui_catalog.cpython-311.pyc",
      "old_path": null
    },
    {
      "status_code": "M",
      "status": "modified",
      "path": "apps/mapper-app/app/build.gradle.kts",
      "old_path": null
    },
    {
      "status_code": "M",
      "status": "modified",
      "path": "apps/mapper-app/app/src/main/java/dev/fishit/mapper/wave01/debug/RuntimeToolkitCommandReceiver.kt",
      "old_path": null
    },
    {
      "status_code": "M",
      "status": "modified",
      "path": "apps/mapper-app/app/src/main/java/dev/fishit/mapper/wave01/debug/RuntimeToolkitTelemetry.kt",
      "old_path": null
    },
    {
      "status_code": "M",
      "status": "modified",
      "path": "apps/mapper-app/app/src/main/java/info/plateaukao/einkbro/activity/BrowserActivity.kt",
      "old_path": null
    },
    {
      "status_code": "M",
      "status": "modified",
      "path": "apps/mapper-app/app/src/main/java/info/plateaukao/einkbro/view/MainContentLayout.kt",
      "old_path": null
    },
    {
      "status_code": "M",
      "status": "modified",
      "path": "apps/mapper-app/app/src/main/res/values/ids.xml",
      "old_path": null
    },
    {
      "status_code": "M",
      "status": "modified",
      "path": "apps/mapper-app/app/src/main/res/values/strings.xml",
      "old_path": null
    },
    {
      "status_code": "M",
      "status": "modified",
      "path": "contracts/decision_trace.json",
      "old_path": null
    },
    {
      "status_code": "M",
      "status": "modified",
      "path": "contracts/doc_contract.json",
      "old_path": null
    },
    {
      "status_code": "M",
      "status": "modified",
      "path": "contracts/generation_plan.json",
      "old_path": null
    },
    {
      "status_code": "M",
      "status": "modified",
      "path": "contracts/mapper_toolkit_tui_catalog.json",
      "old_path": null
    },
    {
      "status_code": "M",
      "status": "modified",
      "path": "contracts/runtime_capture_architecture.md",
      "old_path": null
    },
    {
      "status_code": "M",
      "status": "modified",
      "path": "contracts/runtime_event.schema.json",
      "old_path": null
    },
    {
      "status_code": "M",
      "status": "modified",
      "path": "contracts/runtime_toolkit_v2.json",
      "old_path": null
    },
    {
      "status_code": "M",
      "status": "modified",
      "path": "docs/archive/mapper_toolkit_tui_catalog.contract.json",
      "old_path": null
    },
    {
      "status_code": "M",
      "status": "modified",
      "path": "docs/archive/runtime_event.schema.json",
      "old_path": null
    },
    {
      "status_code": "M",
      "status": "modified",
      "path": "docs/archive/runtime_toolkit_v2.contract.json",
      "old_path": null
    },
    {
      "status_code": "M",
      "status": "modified",
      "path": "scripts/device/mapper-toolkit.sh",
      "old_path": null
    },
    {
      "status_code": "M",
      "status": "modified",
      "path": "scripts/device/toolkit/runtime_dataset_cli.py",
      "old_path": null
    },
    {
      "status_code": "M",
      "status": "modified",
      "path": "scripts/device/toolkit/runtime_toolkit.contract.json",
      "old_path": null
    },
    {
      "status_code": "M",
      "status": "modified",
      "path": "scripts/device/toolkit/tests/fixtures/runtime_regression_zdf.jsonl",
      "old_path": null
    },
    {
      "status_code": "M",
      "status": "modified",
      "path": "scripts/device/toolkit/tests/test_runtime_dataset_hardening.py",
      "old_path": null
    },
    {
      "status_code": "M",
      "status": "modified",
      "path": "scripts/device/toolkit/tests/test_runtime_dataset_integration_smoke.py",
      "old_path": null
    },
    {
      "status_code": "M",
      "status": "modified",
      "path": "scripts/device/toolkit/tests/test_runtime_dataset_regression_fixture.py",
      "old_path": null
    },
    {
      "status_code": "M",
      "status": "modified",
      "path": "scripts/device/toolkit/tests/test_tui_catalog.py",
      "old_path": null
    },
    {
      "status_code": "M",
      "status": "modified",
      "path": "scripts/generate.sh",
      "old_path": null
    }
  ]
}
