{
  "schema_version": 1,
  "handover_id": "HO-20260402T075604Z",
  "generated_at_utc": "2026-04-02T07:56:04Z",
  "agent": {
    "name": "codex",
    "session_label": "HO-20260402T075604Z"
  },
  "scope": "provider-export findings cutover (target_site_id, replay minimization, schema hardening)",
  "highlights": [
    "active query/body minimization + stable export target_site_id + strict fishit_player_contract"
  ],
  "changed_files": [
    {
      "status_code": "?",
      "status": "untracked",
      "path": "contracts/provider_draft_export.schema.json",
      "old_path": null
    },
    {
      "status_code": "?",
      "status": "untracked",
      "path": "docs/archive/provider_draft_export.schema.json",
      "old_path": null
    },
    {
      "status_code": "?",
      "status": "untracked",
      "path": "handovers/HO-20260402T072854Z.json",
      "old_path": null
    },
    {
      "status_code": "?",
      "status": "untracked",
      "path": "logs/device/mapper-toolkit/current/cookie_timeline.json",
      "old_path": null
    },
    {
      "status_code": "?",
      "status": "untracked",
      "path": "logs/device/mapper-toolkit/current/correlation_index.jsonl",
      "old_path": null
    },
    {
      "status_code": "?",
      "status": "untracked",
      "path": "logs/device/mapper-toolkit/current/endpoint_candidates.json",
      "old_path": null
    },
    {
      "status_code": "?",
      "status": "untracked",
      "path": "logs/device/mapper-toolkit/current/events.jsonl",
      "old_path": null
    },
    {
      "status_code": "?",
      "status": "untracked",
      "path": "logs/device/mapper-toolkit/current/events.meta.json",
      "old_path": null
    },
    {
      "status_code": "?",
      "status": "untracked",
      "path": "logs/device/mapper-toolkit/current/extraction_events.jsonl",
      "old_path": null
    },
    {
      "status_code": "?",
      "status": "untracked",
      "path": "logs/device/mapper-toolkit/current/field_matrix.json",
      "old_path": null
    },
    {
      "status_code": "?",
      "status": "untracked",
      "path": "logs/device/mapper-toolkit/current/profile_candidate.json",
      "old_path": null
    },
    {
      "status_code": "?",
      "status": "untracked",
      "path": "logs/device/mapper-toolkit/current/provenance_graph.json",
      "old_path": null
    },
    {
      "status_code": "?",
      "status": "untracked",
      "path": "logs/device/mapper-toolkit/current/provenance_registry.json",
      "old_path": null
    },
    {
      "status_code": "?",
      "status": "untracked",
      "path": "logs/device/mapper-toolkit/current/provider_draft_export.json",
      "old_path": null
    },
    {
      "status_code": "?",
      "status": "untracked",
      "path": "logs/device/mapper-toolkit/current/replay_requirements.json",
      "old_path": null
    },
    {
      "status_code": "?",
      "status": "untracked",
      "path": "logs/device/mapper-toolkit/current/replay_seed.json",
      "old_path": null
    },
    {
      "status_code": "?",
      "status": "untracked",
      "path": "logs/device/mapper-toolkit/current/requests.normalized.jsonl",
      "old_path": null
    },
    {
      "status_code": "?",
      "status": "untracked",
      "path": "logs/device/mapper-toolkit/current/required_cookies_report.json",
      "old_path": null
    },
    {
      "status_code": "?",
      "status": "untracked",
      "path": "logs/device/mapper-toolkit/current/required_headers_report.json",
      "old_path": null
    },
    {
      "status_code": "?",
      "status": "untracked",
      "path": "logs/device/mapper-toolkit/current/response_index.json",
      "old_path": null
    },
    {
      "status_code": "?",
      "status": "untracked",
      "path": "logs/device/mapper-toolkit/current/response_store/index.json",
      "old_path": null
    },
    {
      "status_code": "?",
      "status": "untracked",
      "path": "logs/device/mapper-toolkit/current/responses.normalized.jsonl",
      "old_path": null
    },
    {
      "status_code": "?",
      "status": "untracked",
      "path": "logs/device/mapper-toolkit/current/site_profile.draft.json",
      "old_path": null
    },
    {
      "status_code": "?",
      "status": "untracked",
      "path": "logs/device/mapper-toolkit/current/truncation_events.jsonl",
      "old_path": null
    },
    {
      "status_code": "?",
      "status": "untracked",
      "path": "scripts/device/toolkit/__pycache__/runtime_dataset_cli.cpython-311.pyc",
      "old_path": null
    },
    {
      "status_code": "?",
      "status": "untracked",
      "path": "scripts/device/toolkit/tests/__pycache__/test_runtime_dataset_hardening.cpython-311.pyc",
      "old_path": null
    },
    {
      "status_code": "?",
      "status": "untracked",
      "path": "scripts/device/toolkit/tests/__pycache__/test_runtime_dataset_integration_smoke.cpython-311.pyc",
      "old_path": null
    },
    {
      "status_code": "?",
      "status": "untracked",
      "path": "scripts/device/toolkit/tests/__pycache__/test_runtime_dataset_regression_fixture.cpython-311.pyc",
      "old_path": null
    },
    {
      "status_code": "?",
      "status": "untracked",
      "path": "scripts/device/toolkit/tests/__pycache__/test_triage_dataset_cli.cpython-311.pyc",
      "old_path": null
    },
    {
      "status_code": "M",
      "status": "modified",
      "path": "contracts/decision_trace.json",
      "old_path": null
    },
    {
      "status_code": "M",
      "status": "modified",
      "path": "contracts/doc_contract.json",
      "old_path": null
    },
    {
      "status_code": "M",
      "status": "modified",
      "path": "contracts/generation_plan.json",
      "old_path": null
    },
    {
      "status_code": "M",
      "status": "modified",
      "path": "contracts/mapper_toolkit_tui_catalog.json",
      "old_path": null
    },
    {
      "status_code": "M",
      "status": "modified",
      "path": "contracts/runtime_capture_architecture.md",
      "old_path": null
    },
    {
      "status_code": "M",
      "status": "modified",
      "path": "contracts/runtime_toolkit_v2.json",
      "old_path": null
    },
    {
      "status_code": "M",
      "status": "modified",
      "path": "docs/archive/mapper_toolkit_tui_catalog.contract.json",
      "old_path": null
    },
    {
      "status_code": "M",
      "status": "modified",
      "path": "docs/archive/runtime_toolkit_v2.contract.json",
      "old_path": null
    },
    {
      "status_code": "M",
      "status": "modified",
      "path": "scripts/device/toolkit/runtime_dataset_cli.py",
      "old_path": null
    },
    {
      "status_code": "M",
      "status": "modified",
      "path": "scripts/device/toolkit/tests/fixtures/runtime_regression_zdf.jsonl",
      "old_path": null
    },
    {
      "status_code": "M",
      "status": "modified",
      "path": "scripts/device/toolkit/tests/test_runtime_dataset_hardening.py",
      "old_path": null
    },
    {
      "status_code": "M",
      "status": "modified",
      "path": "scripts/device/toolkit/tests/test_runtime_dataset_integration_smoke.py",
      "old_path": null
    },
    {
      "status_code": "M",
      "status": "modified",
      "path": "scripts/device/toolkit/tests/test_runtime_dataset_regression_fixture.py",
      "old_path": null
    }
  ]
}
