{
  "schema_version": 1,
  "handover_id": "HO-20260410T142817Z",
  "generated_at_utc": "2026-04-10T14:28:17Z",
  "agent": {
    "name": "codex",
    "session_label": "HO-20260410T142817Z"
  },
  "scope": "auth-refresh-nonblocking-export",
  "highlights": [
    "Export no longer fail-closed on incomplete auth refresh chain; optional auth step can auto-skip on Next when unsaturated"
  ],
  "changed_files": [
    {
      "status_code": "?",
      "status": "untracked",
      "path": ".tmp/screens/Screenshot_20260410_104659_FishIT Mapper Lab.jpg",
      "old_path": null
    },
    {
      "status_code": "M",
      "status": "modified",
      "path": "apps/mapper-app/app/src/main/java/dev/fishit/mapper/wave01/debug/RuntimeToolkitSourcePipelineExporter.kt",
      "old_path": null
    },
    {
      "status_code": "M",
      "status": "modified",
      "path": "apps/mapper-app/app/src/main/java/info/plateaukao/einkbro/activity/BrowserActivity.kt",
      "old_path": null
    }
  ]
}
