{
  "schema_version": 1,
  "handover_id": "HO-20260409T151741Z",
  "generated_at_utc": "2026-04-09T15:17:41Z",
  "agent": {
    "name": "codex",
    "session_label": "HO-20260409T151741Z"
  },
  "scope": "wizard playback robustness + runtime export hardening",
  "highlights": [
    "Playback step now saturates on strong PTMD/manifest evidence; build+guards green"
  ],
  "changed_files": [
    {
      "status_code": "?",
      "status": "untracked",
      "path": "handovers/HO-20260409T125225Z.json",
      "old_path": null
    },
    {
      "status_code": "M",
      "status": "modified",
      "path": "apps/mapper-app/app/src/main/java/dev/fishit/mapper/wave01/debug/RuntimeToolkitCommandReceiver.kt",
      "old_path": null
    },
    {
      "status_code": "M",
      "status": "modified",
      "path": "apps/mapper-app/app/src/main/java/dev/fishit/mapper/wave01/debug/RuntimeToolkitSourcePipelineExporter.kt",
      "old_path": null
    },
    {
      "status_code": "M",
      "status": "modified",
      "path": "apps/mapper-app/app/src/main/java/dev/fishit/mapper/wave01/debug/RuntimeToolkitTelemetry.kt",
      "old_path": null
    },
    {
      "status_code": "M",
      "status": "modified",
      "path": "apps/mapper-app/app/src/main/java/info/plateaukao/einkbro/activity/BrowserActivity.kt",
      "old_path": null
    }
  ]
}
