{
  "schema_version": 1,
  "handover_id": "HO-20260410T131231Z",
  "generated_at_utc": "2026-04-10T13:12:31Z",
  "agent": {
    "name": "codex",
    "session_label": "HO-20260410T131231Z"
  },
  "scope": "wizard-overlay-floating-drag-minimize-focus",
  "highlights": [
    "Wizard overlay now supports edge-drag floating behavior, improved minimized focus context, and validated button wiring"
  ],
  "changed_files": [
    {
      "status_code": "?",
      "status": "untracked",
      "path": ".tmp/screens/Screenshot_20260410_104659_FishIT Mapper Lab.jpg",
      "old_path": null
    },
    {
      "status_code": "?",
      "status": "untracked",
      "path": "apps/mapper-app/app/src/main/res/drawable/mapper_wizard_drag_border.xml",
      "old_path": null
    },
    {
      "status_code": "M",
      "status": "modified",
      "path": "apps/mapper-app/app/src/main/java/info/plateaukao/einkbro/activity/BrowserActivity.kt",
      "old_path": null
    },
    {
      "status_code": "M",
      "status": "modified",
      "path": "apps/mapper-app/app/src/main/java/info/plateaukao/einkbro/view/MainContentLayout.kt",
      "old_path": null
    }
  ]
}
