{
  "schema_version": 1,
  "handover_id": "HO-20260409T091318Z",
  "generated_at_utc": "2026-04-09T09:13:18Z",
  "agent": {
    "name": "codex",
    "session_label": "HO-20260409T091318Z"
  },
  "scope": "tree cleanup and artifact hygiene",
  "highlights": [
    "Committed missing HO handovers, added ignore rules, and removed unneeded local artifacts"
  ],
  "changed_files": [
    {
      "status_code": "?",
      "status": "untracked",
      "path": "handovers/HO-20260406T093628Z.json",
      "old_path": null
    },
    {
      "status_code": "?",
      "status": "untracked",
      "path": "handovers/HO-20260406T103302Z.json",
      "old_path": null
    },
    {
      "status_code": "?",
      "status": "untracked",
      "path": "handovers/HO-20260406T103358Z.json",
      "old_path": null
    },
    {
      "status_code": "?",
      "status": "untracked",
      "path": "handovers/HO-20260406T184751Z.json",
      "old_path": null
    },
    {
      "status_code": "?",
      "status": "untracked",
      "path": "handovers/HO-20260406T184815Z.json",
      "old_path": null
    },
    {
      "status_code": "?",
      "status": "untracked",
      "path": "handovers/HO-20260406T185615Z.json",
      "old_path": null
    },
    {
      "status_code": "?",
      "status": "untracked",
      "path": "handovers/HO-20260406T190836Z.json",
      "old_path": null
    },
    {
      "status_code": "?",
      "status": "untracked",
      "path": "handovers/HO-20260406T191945Z.json",
      "old_path": null
    },
    {
      "status_code": "?",
      "status": "untracked",
      "path": "handovers/HO-20260406T195809Z.json",
      "old_path": null
    },
    {
      "status_code": "?",
      "status": "untracked",
      "path": "handovers/HO-20260406T200056Z.json",
      "old_path": null
    },
    {
      "status_code": "?",
      "status": "untracked",
      "path": "handovers/HO-20260406T200340Z.json",
      "old_path": null
    },
    {
      "status_code": "?",
      "status": "untracked",
      "path": "handovers/HO-20260406T201636Z.json",
      "old_path": null
    },
    {
      "status_code": "?",
      "status": "untracked",
      "path": "handovers/HO-20260406T203618Z.json",
      "old_path": null
    },
    {
      "status_code": "?",
      "status": "untracked",
      "path": "handovers/HO-20260406T204807Z.json",
      "old_path": null
    },
    {
      "status_code": "?",
      "status": "untracked",
      "path": "handovers/HO-20260409T084336Z.json",
      "old_path": null
    },
    {
      "status_code": "M",
      "status": "modified",
      "path": ".gitignore",
      "old_path": null
    }
  ]
}
