{
  "schema_version": 1,
  "handover_id": "HO-20260409T101316Z",
  "generated_at_utc": "2026-04-09T10:13:16Z",
  "agent": {
    "name": "codex",
    "session_label": "HO-20260409T101316Z"
  },
  "scope": "wizard capture lifecycle + overlay saturation + ready correlation bugfix pass",
  "highlights": [
    "Fixed re-arm and correlation-context bugs, validated RuntimeToolkit tests, ready to push"
  ],
  "changed_files": [
    {
      "status_code": "?",
      "status": "untracked",
      "path": "apps/mapper-app/app/src/test/java/dev/fishit/mapper/wave01/debug/RuntimeToolkitTelemetryWizardFlowTest.kt",
      "old_path": null
    },
    {
      "status_code": "?",
      "status": "untracked",
      "path": "handovers/HO-20260409T100218Z.json",
      "old_path": null
    },
    {
      "status_code": "M",
      "status": "modified",
      "path": "apps/mapper-app/app/build.gradle.kts",
      "old_path": null
    },
    {
      "status_code": "M",
      "status": "modified",
      "path": "apps/mapper-app/app/src/main/java/dev/fishit/mapper/wave01/debug/RuntimeToolkitCommandReceiver.kt",
      "old_path": null
    },
    {
      "status_code": "M",
      "status": "modified",
      "path": "apps/mapper-app/app/src/main/java/dev/fishit/mapper/wave01/debug/RuntimeToolkitTelemetry.kt",
      "old_path": null
    },
    {
      "status_code": "M",
      "status": "modified",
      "path": "apps/mapper-app/app/src/main/java/info/plateaukao/einkbro/activity/BrowserActivity.kt",
      "old_path": null
    },
    {
      "status_code": "M",
      "status": "modified",
      "path": "apps/mapper-app/app/src/main/java/info/plateaukao/einkbro/view/MainContentLayout.kt",
      "old_path": null
    },
    {
      "status_code": "M",
      "status": "modified",
      "path": "apps/mapper-app/app/src/main/res/values/ids.xml",
      "old_path": null
    },
    {
      "status_code": "M",
      "status": "modified",
      "path": "apps/mapper-app/app/src/main/res/values/strings.xml",
      "old_path": null
    }
  ]
}
